mysql> SELECT BRAND, COUNT(*) FROM jd_comment GROUP BY BRAND;
+-------------------+----------+
| BRAND             | COUNT(*) |
+-------------------+----------+
| Apple             |   110590 |
| 苹果（Apple）      |    30956 |
+-------------------+----------+
2 rows in set (0.55 sec)

mysql> SELECT PRODUCT_NAME, COUNT(*) FROM jd_comment GROUP BY PRODUCT_NAME;
+---------------------+----------+
| PRODUCT_NAME        | COUNT(*) |
+---------------------+----------+
| 苹果iPhone 4s       |    27279 |
| 苹果iPhone 5c       |    10862 |
| 苹果iPhone 5s       |    99914 |
| 苹果iPhone 6        |     2978 |
| 苹果iPhone 6 Plus   |      513 |
+---------------------+----------+
5 rows in set (0.39 sec)

mysql> SELECT PRODUCT_ID, COUNT(*) FROM jd_comment GROUP BY PRODUCT_ID;
+------------+----------+
| PRODUCT_ID | COUNT(*) |
+------------+----------+
|     971478 |      655 |
|     971479 |      860 |
|     971508 |     5291 |
|     971513 |      225 |
|     974401 |     2620 |
|     975603 |       65 |
|     975628 |     1662 |
|     975631 |     2800 |
|     975641 |     8739 |
|     976898 |      855 |
|     976905 |      327 |
|     978316 |    16694 |
|     978317 |     7706 |
|     981821 |      588 |
|     981822 |      977 |
|    1023433 |    21988 |
|    1023437 |    11156 |
|    1023438 |     4865 |
|    1057727 |       47 |
|    1057728 |      324 |
|    1057732 |       87 |
|    1057736 |      187 |
|    1057737 |      985 |
|    1057740 |     5671 |
|    1057741 |    12211 |
|    1057746 |    29278 |
|    1098265 |      285 |
|    1098274 |      475 |
|    1098277 |       59 |
|    1180245 |       34 |
|    1180256 |       38 |
|    1182969 |       75 |
|    1188043 |       40 |
|    1188053 |       17 |
|    1217494 |     2913 |
|    1217524 |      168 |
|    1219071 |      129 |
|    1219072 |       56 |
|    1219073 |      102 |
|    1229054 |      169 |
|    1240268 |       65 |
|    1240275 |       37 |
|    1240278 |       13 |
|    1240295 |        8 |
+------------+----------+
44 rows in set (0.13 sec)

mysql> SELECT ORIGINAL_PRICE, COUNT(*) FROM jd_comment GROUP BY ORIGINAL_PRICE;
+----------------+----------+
| ORIGINAL_PRICE | COUNT(*) |
+----------------+----------+
|           2499 |    24475 |
|           3288 |     1622 |
|           3500 |     1182 |
|           3999 |     5281 |
|           4788 |       65 |
|           4888 |       72 |
|           5299 |    93768 |
|           5388 |     2620 |
|           5500 |       65 |
|           5999 |     8739 |
|           6088 |      860 |
|           6099 |     2319 |
|           6300 |       58 |
|           6888 |      185 |
|           6899 |      134 |
|           7299 |      102 |
+----------------+----------+
16 rows in set (0.12 sec)

mysql> SELECT PRICE, COUNT(*) FROM jd_comment GROUP BY PRICE;
+-------+----------+
| PRICE | COUNT(*) |
+-------+----------+
|  1988 |       57 |
|  2059 |     1565 |
|  2199 |    24475 |
|  2588 |      819 |
|  2599 |     1182 |
|  2688 |     1662 |
|  2788 |     2800 |
|  2888 |       65 |
|  3199 |      225 |
|  3299 |     5291 |
|  4099 |      169 |
|  4188 |    38081 |
|  4199 |    55899 |
|  4299 |     2620 |
|  4448 |     1515 |
|  4868 |     1496 |
|  5288 |     2913 |
|  5488 |      134 |
|  5499 |       65 |
|  6088 |      455 |
|  6299 |       58 |
+-------+----------+
21 rows in set (0.13 sec)

mysql> SELECT GOOD_RATE, COUNT(*) FROM jd_comment GROUP BY GOOD_RATE;
+-----------+----------+
| GOOD_RATE | COUNT(*) |
+-----------+----------+
| 100%      |       17 |
| 87%       |      335 |
| 88%       |      102 |
| 90%       |      920 |
| 91%       |    24783 |
| 92%       |      128 |
| 93%       |     4365 |
| 94%       |     2213 |
| 95%       |    86238 |
| 96%       |    22018 |
| 97%       |      259 |
| 99%       |      168 |
+-----------+----------+
12 rows in set (0.24 sec)

mysql> SELECT MODEL, COUNT(*) FROM jd_comment GROUP BY MODEL;
+----------------------------------------+----------+
| MODEL                                  | COUNT(*) |
+----------------------------------------+----------+
|                                        |     3591 |
| 16G-联通全兼容版A1524                  |       58 |
| 16G-联通全兼容版A1586                  |       23 |
| 16G开放版                              |      799 |
| 16G电信合约版                          |      120 |
| 16G电信版                              |     2643 |
| 16G移动版                              |     1659 |
| 2013-09-19                             |        6 |
| 2013-09-20                             |        1 |
| 2013-09-21                             |        5 |
| 2013-09-22                             |        1 |
| 2013-09-23                             |        5 |
| 2013-09-25                             |        2 |
| 2013-09-26                             |       22 |
| 2013-09-27                             |       19 |
| 2013-09-28                             |        3 |
| 2013-09-29                             |        8 |
| 2013-09-30                             |       10 |
| 2013-10-01                             |        5 |
| 2013-10-02                             |        2 |
| 2013-10-03                             |        3 |
| 2013-10-04                             |        2 |
| 2013-10-08                             |        1 |
| 2013-10-13                             |        8 |
| 2013-10-14                             |        1 |
| 2013-10-15                             |        3 |
| 2013-10-16                             |        6 |
| 2013-10-17                             |        4 |
| 2013-10-18                             |        2 |
| 2013-10-19                             |        1 |
| 2013-10-20                             |        3 |
| 2013-10-21                             |        4 |
| 2013-10-22                             |        4 |
| 2013-10-23                             |        5 |
| 2013-10-24                             |        3 |
| 2013-10-25                             |        8 |
| 2013-10-26                             |        3 |
| 2013-10-27                             |        2 |
| 2013-10-28                             |        2 |
| 2013-10-29                             |        4 |
| 2013-10-31                             |        2 |
| 2013-11-01                             |        2 |
| 2013-11-02                             |        3 |
| 2013-11-03                             |        6 |
| 2013-11-04                             |        3 |
| 2013-11-05                             |        1 |
| 2013-11-06                             |        2 |
| 2013-11-07                             |        1 |
| 2013-11-08                             |        2 |
| 2013-11-09                             |        2 |
| 2013-11-11                             |        7 |
| 2013-11-12                             |        5 |
| 2013-11-13                             |        2 |
| 2013-11-14                             |        3 |
| 2013-11-15                             |        1 |
| 2013-11-16                             |        1 |
| 2013-11-18                             |        1 |
| 2013-11-19                             |        3 |
| 2013-11-21                             |        4 |
| 2013-11-22                             |        3 |
| 2013-11-24                             |        2 |
| 2013-11-25                             |        1 |
| 2013-11-27                             |        2 |
| 2013-11-28                             |        1 |
| 2013-11-29                             |        1 |
| 2013-12-01                             |        1 |
| 2013-12-02                             |        6 |
| 2013-12-03                             |        3 |
| 2013-12-04                             |        2 |
| 2013-12-05                             |        1 |
| 2013-12-06                             |        1 |
| 2013-12-07                             |        1 |
| 2013-12-08                             |        3 |
| 2013-12-10                             |        1 |
| 2013-12-12                             |        1 |
| 2013-12-13                             |        3 |
| 2013-12-14                             |        3 |
| 2013-12-15                             |        2 |
| 2013-12-16                             |        2 |
| 2013-12-17                             |        3 |
| 2013-12-18                             |        1 |
| 2013-12-19                             |        1 |
| 2013-12-20                             |        3 |
| 2013-12-21                             |        3 |
| 2013-12-22                             |        2 |
| 2013-12-24                             |        7 |
| 2013-12-25                             |        3 |
| 2013-12-26                             |        3 |
| 2013-12-27                             |        2 |
| 2013-12-29                             |        3 |
| 2013-12-30                             |        1 |
| 2013-12-31                             |        2 |
| 2014-01-01                             |        5 |
| 2014-01-02                             |        1 |
| 2014-01-03                             |        3 |
| 2014-01-04                             |        6 |
| 2014-01-05                             |        7 |
| 2014-01-06                             |        1 |
| 2014-01-07                             |        5 |
| 2014-01-08                             |        1 |
| 2014-01-09                             |        4 |
| 2014-01-10                             |        8 |
| 2014-01-11                             |        4 |
| 2014-01-12                             |        4 |
| 2014-01-13                             |        1 |
| 2014-01-14                             |        6 |
| 2014-01-15                             |        2 |
| 2014-01-16                             |        5 |
| 2014-01-17                             |        5 |
| 2014-01-18                             |        3 |
| 2014-01-19                             |        8 |
| 2014-01-20                             |        5 |
| 2014-01-21                             |        2 |
| 2014-01-22                             |        6 |
| 2014-01-23                             |        5 |
| 2014-01-24                             |        7 |
| 2014-01-25                             |        6 |
| 2014-01-26                             |        2 |
| 2014-01-27                             |        3 |
| 2014-01-28                             |        1 |
| 2014-01-29                             |        1 |
| 2014-01-30                             |        2 |
| 2014-01-31                             |        2 |
| 2014-02-02                             |        4 |
| 2014-02-03                             |        3 |
| 2014-02-04                             |        1 |
| 2014-02-05                             |        9 |
| 2014-02-06                             |        6 |
| 2014-02-07                             |        7 |
| 2014-02-08                             |        5 |
| 2014-02-09                             |        4 |
| 2014-02-10                             |        7 |
| 2014-02-11                             |        6 |
| 2014-02-12                             |        3 |
| 2014-02-13                             |        4 |
| 2014-02-14                             |       14 |
| 2014-02-15                             |        9 |
| 2014-02-16                             |       15 |
| 2014-02-17                             |       10 |
| 2014-02-18                             |        4 |
| 2014-02-19                             |        8 |
| 2014-02-20                             |        7 |
| 2014-02-21                             |        5 |
| 2014-02-23                             |        8 |
| 2014-02-24                             |        7 |
| 2014-02-25                             |        5 |
| 2014-02-26                             |        6 |
| 2014-02-27                             |       12 |
| 2014-02-28                             |        7 |
| 2014-03-01                             |       15 |
| 2014-03-02                             |        5 |
| 2014-03-03                             |        6 |
| 2014-03-04                             |       10 |
| 2014-03-05                             |        8 |
| 2014-03-06                             |        7 |
| 2014-03-07                             |       19 |
| 2014-03-08                             |       14 |
| 2014-03-09                             |        4 |
| 2014-03-10                             |        6 |
| 2014-03-11                             |       10 |
| 2014-03-12                             |        4 |
| 2014-03-13                             |        4 |
| 2014-03-14                             |        9 |
| 2014-03-15                             |        7 |
| 2014-03-16                             |        8 |
| 2014-03-17                             |        9 |
| 2014-03-18                             |        4 |
| 2014-03-19                             |       11 |
| 2014-03-20                             |        4 |
| 2014-03-21                             |        6 |
| 2014-03-22                             |        3 |
| 2014-03-23                             |        5 |
| 2014-03-24                             |        5 |
| 2014-03-25                             |        2 |
| 2014-03-26                             |        5 |
| 2014-03-27                             |        4 |
| 2014-03-28                             |        6 |
| 2014-03-29                             |        2 |
| 2014-03-30                             |        3 |
| 2014-03-31                             |        5 |
| 2014-04-01                             |        6 |
| 2014-04-02                             |        4 |
| 2014-04-03                             |        2 |
| 2014-04-05                             |        1 |
| 2014-04-06                             |        1 |
| 2014-04-07                             |       10 |
| 2014-04-08                             |        5 |
| 2014-04-09                             |        4 |
| 2014-04-10                             |        8 |
| 2014-04-11                             |        2 |
| 2014-04-12                             |        3 |
| 2014-04-13                             |        6 |
| 2014-04-14                             |        7 |
| 2014-04-15                             |        8 |
| 2014-04-16                             |        4 |
| 2014-04-17                             |        4 |
| 2014-04-18                             |        9 |
| 2014-04-19                             |       12 |
| 2014-04-20                             |       12 |
| 2014-04-21                             |        5 |
| 2014-04-22                             |        4 |
| 2014-04-23                             |        8 |
| 2014-04-24                             |        5 |
| 2014-04-25                             |        7 |
| 2014-04-26                             |        6 |
| 2014-04-27                             |        4 |
| 2014-04-28                             |       11 |
| 2014-04-30                             |        4 |
| 2014-05-01                             |        8 |
| 2014-05-02                             |        2 |
| 2014-05-03                             |        3 |
| 2014-05-04                             |        6 |
| 2014-05-05                             |        7 |
| 2014-05-06                             |        6 |
| 2014-05-07                             |        7 |
| 2014-05-08                             |        7 |
| 2014-05-09                             |        6 |
| 2014-05-10                             |        6 |
| 2014-05-11                             |        1 |
| 2014-05-12                             |        2 |
| 2014-05-13                             |        5 |
| 2014-05-14                             |        7 |
| 2014-05-15                             |        5 |
| 2014-05-16                             |        5 |
| 2014-05-17                             |        8 |
| 2014-05-18                             |        1 |
| 2014-05-19                             |        2 |
| 2014-05-20                             |        6 |
| 2014-05-21                             |        5 |
| 2014-05-22                             |        1 |
| 2014-05-23                             |        4 |
| 2014-05-24                             |        3 |
| 2014-05-25                             |        5 |
| 2014-05-26                             |        4 |
| 2014-05-27                             |        4 |
| 2014-05-28                             |        1 |
| 2014-05-29                             |        1 |
| 2014-05-30                             |        4 |
| 2014-05-31                             |        2 |
| 2014-06-01                             |        1 |
| 2014-06-03                             |        1 |
| 2014-06-04                             |        2 |
| 2014-06-05                             |        5 |
| 2014-06-06                             |        3 |
| 2014-06-07                             |        4 |
| 2014-06-08                             |        5 |
| 2014-06-09                             |        6 |
| 2014-06-10                             |        1 |
| 2014-06-11                             |        3 |
| 2014-06-12                             |        1 |
| 2014-06-13                             |        1 |
| 2014-06-14                             |        2 |
| 2014-06-15                             |        4 |
| 2014-06-16                             |        4 |
| 2014-06-17                             |        3 |
| 2014-06-18                             |       12 |
| 2014-06-19                             |        7 |
| 2014-06-20                             |        6 |
| 2014-06-21                             |        2 |
| 2014-06-22                             |        4 |
| 2014-06-23                             |        2 |
| 2014-06-24                             |        2 |
| 2014-06-25                             |        4 |
| 2014-06-26                             |        1 |
| 2014-06-27                             |        2 |
| 2014-06-28                             |        1 |
| 2014-07-01                             |        3 |
| 2014-07-02                             |        1 |
| 2014-07-03                             |        2 |
| 2014-07-04                             |        1 |
| 2014-07-05                             |        2 |
| 2014-07-06                             |        1 |
| 2014-07-07                             |        1 |
| 2014-07-08                             |        1 |
| 2014-07-09                             |        1 |
| 2014-07-10                             |        4 |
| 2014-07-12                             |        3 |
| 2014-07-13                             |        2 |
| 2014-07-14                             |        2 |
| 2014-07-15                             |        1 |
| 2014-07-16                             |        1 |
| 2014-07-17                             |        5 |
| 2014-07-18                             |        1 |
| 2014-07-20                             |        1 |
| 2014-07-21                             |        1 |
| 2014-07-22                             |        1 |
| 2014-07-25                             |        1 |
| 2014-07-29                             |        1 |
| 2014-08-01                             |        1 |
| 2014-08-03                             |        1 |
| 2014-08-05                             |        1 |
| 2014-08-09                             |        1 |
| 2014-08-28                             |        1 |
| 2014-09-01                             |        1 |
| 2014-09-09                             |        1 |
| 2014-09-22                             |        1 |
| 32G                                    |       54 |
| 32G开放版                              |       84 |
| 32G版                                  |     4440 |
| 32G电信版                              |        1 |
| 4S 8G电信版                            |     2063 |
| 64G开放版                              |        9 |
| 【16G】全兼容版                        |       42 |
| 【16G】抢AAA靓号,最高赠费6088          |       28 |
| 公开版（16G ROM）                      |      168 |
| 开放版4G(16G ROM)                      |    43058 |
| 开放版4G(32G ROM)                      |     1412 |
| 开放版4G(64G ROM)                      |      125 |
| 电信3G(16G ROM)                        |    13103 |
| 电信3G(32G ROM)                        |       64 |
| 电信3G(8G ROM)                         |    22636 |
| 电信3G(8GROM)                          |      453 |
| 电信合约版 （16G）                     |      139 |
| 移动4G(16G ROM)                        |    36301 |
| 移动4G版(16G ROM)                      |     2913 |
| 联通3G(32G ROM)                        |     2534 |
| 联通3G(8G ROM)                         |     1565 |
| 购机送费                               |      241 |
+----------------------------------------+----------+

mysql> UPDATE jd_comment SET MODEL = '' WHERE MODEL REGEXP '^[0-9]+\\-[0-9]+\\-[0-9]+';
Query OK, 1220 rows affected (0.33 sec)
Rows matched: 1220  Changed: 1220  Warnings: 0

mysql> SELECT MODEL, COUNT(*) FROM jd_comment GROUP BY MODEL;
+----------------------------------------+----------+
| MODEL                                  | COUNT(*) |
+----------------------------------------+----------+
| MODEL                                  | COUNT(*) |
+----------------------------------------+----------+
|                                        |     4811 |
| 16G-联通全兼容版A1524                  |       58 |
| 16G-联通全兼容版A1586                  |       23 |
| 16G开放版                              |      799 |
| 16G电信合约版                          |      120 |
| 16G电信版                              |     2643 |
| 16G移动版                              |     1659 |
| 32G                                    |       54 |
| 32G开放版                              |       84 |
| 32G版                                  |     4440 |
| 32G电信版                              |        1 |
| 4S 8G电信版                            |     2063 |
| 64G开放版                              |        9 |
| 【16G】全兼容版                        |       42 |
| 【16G】抢AAA靓号,最高赠费6088          |       28 |
| 公开版（16G ROM）                      |      168 |
| 开放版4G(16G ROM)                      |    43058 |
| 开放版4G(32G ROM)                      |     1412 |
| 开放版4G(64G ROM)                      |      125 |
| 电信3G(16G ROM)                        |    13103 |
| 电信3G(32G ROM)                        |       64 |
| 电信3G(8G ROM)                         |    22636 |
| 电信3G(8GROM)                          |      453 |
| 电信合约版 （16G）                     |      139 |
| 移动4G(16G ROM)                        |    36301 |
| 移动4G版(16G ROM)                      |     2913 |
| 联通3G(32G ROM)                        |     2534 |
| 联通3G(8G ROM)                         |     1565 |
| 购机送费                               |      241 |
+----------------------------------------+----------+
29 rows in set (0.30 sec)

mysql> SELECT RATING, COUNT(*) FROM jd_comment GROUP BY RATING;
+--------+----------+
| RATING | COUNT(*) |
+--------+----------+
|      1 |     3731 |
|      2 |     1077 |
|      3 |     3347 |
|      4 |    12832 |
|      5 |   120559 |
+--------+----------+
5 rows in set (0.12 sec)

mysql> SELECT BUY_DATE, COUNT(*) FROM jd_comment GROUP BY BUY_DATE;
+------------+----------+
| BUY_DATE   | COUNT(*) |
+------------+----------+
| 0001-09-01 |        1 |
| 0002-01-16 |        1 |
| 0003-07-23 |        1 |
| 0005-07-11 |        1 |
| 0005-08-14 |        1 |
| 0009-04-15 |        1 |
| 0011-02-02 |        1 |
| 0013-02-21 |        1 |
| 0020-10-16 |        1 |
| 0023-09-25 |        1 |
| 0037-08-01 |        1 |
| 0038-01-09 |        1 |
| 0046-08-30 |        1 |
| 0046-10-25 |        1 |
| 1013-12-10 |        1 |
| 1900-01-01 |       18 |
| 1914-01-03 |        1 |
| 1970-01-01 |       15 |
| 1970-01-04 |        1 |
| 1970-01-16 |        1 |
| 1970-06-25 |        1 |
| 1970-11-02 |        1 |
| 2013-09-19 |       10 |
| 2013-09-20 |       42 |
| 2013-09-21 |       11 |
| 2013-09-22 |        4 |
| 2013-09-23 |        5 |
| 2013-09-24 |        3 |
| 2013-09-25 |        5 |
| 2013-09-26 |       31 |
| 2013-09-27 |       42 |
| 2013-09-28 |       27 |
| 2013-09-29 |       31 |
| 2013-09-30 |       28 |
| 2013-10-01 |       24 |
| 2013-10-02 |       20 |
| 2013-10-03 |       19 |
| 2013-10-04 |        6 |
| 2013-10-05 |       43 |
| 2013-10-06 |       13 |
| 2013-10-07 |       25 |
| 2013-10-08 |       42 |
| 2013-10-09 |       54 |
| 2013-10-10 |       40 |
| 2013-10-11 |       32 |
| 2013-10-12 |       38 |
| 2013-10-13 |       26 |
| 2013-10-14 |       12 |
| 2013-10-15 |        6 |
| 2013-10-16 |       13 |
| 2013-10-17 |       33 |
| 2013-10-18 |       38 |
| 2013-10-19 |       19 |
| 2013-10-20 |       12 |
| 2013-10-21 |       14 |
| 2013-10-22 |       22 |
| 2013-10-23 |       29 |
| 2013-10-24 |       27 |
| 2013-10-25 |       18 |
| 2013-10-26 |       47 |
| 2013-10-27 |       29 |
| 2013-10-28 |       34 |
| 2013-10-29 |       25 |
| 2013-10-30 |       11 |
| 2013-10-31 |       28 |
| 2013-11-01 |       11 |
| 2013-11-02 |       13 |
| 2013-11-03 |       11 |
| 2013-11-04 |       30 |
| 2013-11-05 |       43 |
| 2013-11-06 |       39 |
| 2013-11-07 |       41 |
| 2013-11-08 |       26 |
| 2013-11-09 |       42 |
| 2013-11-10 |       38 |
| 2013-11-11 |      247 |
| 2013-11-12 |       57 |
| 2013-11-13 |       48 |
| 2013-11-14 |       54 |
| 2013-11-15 |       34 |
| 2013-11-16 |       39 |
| 2013-11-17 |       30 |
| 2013-11-18 |      236 |
| 2013-11-19 |      130 |
| 2013-11-20 |      119 |
| 2013-11-21 |      113 |
| 2013-11-22 |      124 |
| 2013-11-23 |      101 |
| 2013-11-24 |      135 |
| 2013-11-25 |      127 |
| 2013-11-26 |      103 |
| 2013-11-27 |       97 |
| 2013-11-28 |      104 |
| 2013-11-29 |      100 |
| 2013-11-30 |       87 |
| 2013-12-01 |       70 |
| 2013-12-02 |       82 |
| 2013-12-03 |       83 |
| 2013-12-04 |       94 |
| 2013-12-05 |       72 |
| 2013-12-06 |       68 |
| 2013-12-07 |       80 |
| 2013-12-08 |       66 |
| 2013-12-09 |       61 |
| 2013-12-10 |       85 |
| 2013-12-11 |      136 |
| 2013-12-12 |      445 |
| 2013-12-13 |      231 |
| 2013-12-14 |      178 |
| 2013-12-15 |      197 |
| 2013-12-16 |      138 |
| 2013-12-17 |      150 |
| 2013-12-18 |      135 |
| 2013-12-19 |      139 |
| 2013-12-20 |      141 |
| 2013-12-21 |      103 |
| 2013-12-22 |      108 |
| 2013-12-23 |      113 |
| 2013-12-24 |      102 |
| 2013-12-25 |      120 |
| 2013-12-26 |      119 |
| 2013-12-27 |       83 |
| 2013-12-28 |      102 |
| 2013-12-29 |       72 |
| 2013-12-30 |      119 |
| 2013-12-31 |      151 |
| 2014-01-01 |      333 |
| 2014-01-02 |      234 |
| 2014-01-03 |      169 |
| 2014-01-04 |      116 |
| 2014-01-05 |       84 |
| 2014-01-06 |      178 |
| 2014-01-07 |      162 |
| 2014-01-08 |      141 |
| 2014-01-09 |      113 |
| 2014-01-10 |      251 |
| 2014-01-11 |      146 |
| 2014-01-12 |       96 |
| 2014-01-13 |      161 |
| 2014-01-14 |      143 |
| 2014-01-15 |      141 |
| 2014-01-16 |      140 |
| 2014-01-17 |      409 |
| 2014-01-18 |      312 |
| 2014-01-19 |      226 |
| 2014-01-20 |      312 |
| 2014-01-21 |      280 |
| 2014-01-22 |      355 |
| 2014-01-23 |      344 |
| 2014-01-24 |      333 |
| 2014-01-25 |      285 |
| 2014-01-26 |      276 |
| 2014-01-27 |      239 |
| 2014-01-28 |      218 |
| 2014-01-29 |      148 |
| 2014-01-30 |       93 |
| 2014-01-31 |      108 |
| 2014-02-01 |      144 |
| 2014-02-02 |      177 |
| 2014-02-03 |      230 |
| 2014-02-04 |      211 |
| 2014-02-05 |      257 |
| 2014-02-06 |      265 |
| 2014-02-07 |      291 |
| 2014-02-08 |      299 |
| 2014-02-09 |      270 |
| 2014-02-10 |      407 |
| 2014-02-11 |      413 |
| 2014-02-12 |      392 |
| 2014-02-13 |      395 |
| 2014-02-14 |      407 |
| 2014-02-15 |      317 |
| 2014-02-16 |      307 |
| 2014-02-17 |      354 |
| 2014-02-18 |      377 |
| 2014-02-19 |      353 |
| 2014-02-20 |      358 |
| 2014-02-21 |      336 |
| 2014-02-22 |      343 |
| 2014-02-23 |      296 |
| 2014-02-24 |      402 |
| 2014-02-25 |      338 |
| 2014-02-26 |      374 |
| 2014-02-27 |      324 |
| 2014-02-28 |      296 |
| 2014-03-01 |      312 |
| 2014-03-02 |      239 |
| 2014-03-03 |      315 |
| 2014-03-04 |      313 |
| 2014-03-05 |      302 |
| 2014-03-06 |      299 |
| 2014-03-07 |      403 |
| 2014-03-08 |      457 |
| 2014-03-09 |      299 |
| 2014-03-10 |      332 |
| 2014-03-11 |      392 |
| 2014-03-12 |      329 |
| 2014-03-13 |      344 |
| 2014-03-14 |      358 |
| 2014-03-15 |      363 |
| 2014-03-16 |      302 |
| 2014-03-17 |      345 |
| 2014-03-18 |      379 |
| 2014-03-19 |      411 |
| 2014-03-20 |      400 |
| 2014-03-21 |      405 |
| 2014-03-22 |      319 |
| 2014-03-23 |      314 |
| 2014-03-24 |      388 |
| 2014-03-25 |      357 |
| 2014-03-26 |      354 |
| 2014-03-27 |      348 |
| 2014-03-28 |      366 |
| 2014-03-29 |      338 |
| 2014-03-30 |      356 |
| 2014-03-31 |      359 |
| 2014-04-01 |      435 |
| 2014-04-02 |      394 |
| 2014-04-03 |      366 |
| 2014-04-04 |      311 |
| 2014-04-05 |      292 |
| 2014-04-06 |      271 |
| 2014-04-07 |      286 |
| 2014-04-08 |      326 |
| 2014-04-09 |      391 |
| 2014-04-10 |      399 |
| 2014-04-11 |      363 |
| 2014-04-12 |      371 |
| 2014-04-13 |      382 |
| 2014-04-14 |      383 |
| 2014-04-15 |      371 |
| 2014-04-16 |      410 |
| 2014-04-17 |      408 |
| 2014-04-18 |      395 |
| 2014-04-19 |      377 |
| 2014-04-20 |      257 |
| 2014-04-21 |      334 |
| 2014-04-22 |      356 |
| 2014-04-23 |      372 |
| 2014-04-24 |      363 |
| 2014-04-25 |      366 |
| 2014-04-26 |      321 |
| 2014-04-27 |      268 |
| 2014-04-28 |      374 |
| 2014-04-29 |      402 |
| 2014-04-30 |      373 |
| 2014-05-01 |      557 |
| 2014-05-02 |      390 |
| 2014-05-03 |      337 |
| 2014-05-04 |      428 |
| 2014-05-05 |      388 |
| 2014-05-06 |      388 |
| 2014-05-07 |      396 |
| 2014-05-08 |      350 |
| 2014-05-09 |      368 |
| 2014-05-10 |      378 |
| 2014-05-11 |      314 |
| 2014-05-12 |      390 |
| 2014-05-13 |      345 |
| 2014-05-14 |      308 |
| 2014-05-15 |      339 |
| 2014-05-16 |      355 |
| 2014-05-17 |      330 |
| 2014-05-18 |      330 |
| 2014-05-19 |      412 |
| 2014-05-20 |      437 |
| 2014-05-21 |      383 |
| 2014-05-22 |      360 |
| 2014-05-23 |      327 |
| 2014-05-24 |      309 |
| 2014-05-25 |      285 |
| 2014-05-26 |      392 |
| 2014-05-27 |      371 |
| 2014-05-28 |      409 |
| 2014-05-29 |      373 |
| 2014-05-30 |      348 |
| 2014-05-31 |      383 |
| 2014-06-01 |      387 |
| 2014-06-02 |      465 |
| 2014-06-03 |      476 |
| 2014-06-04 |      550 |
| 2014-06-05 |      515 |
| 2014-06-06 |      514 |
| 2014-06-07 |      484 |
| 2014-06-08 |      381 |
| 2014-06-09 |      537 |
| 2014-06-10 |      557 |
| 2014-06-11 |      493 |
| 2014-06-12 |      511 |
| 2014-06-13 |      512 |
| 2014-06-14 |      525 |
| 2014-06-15 |      398 |
| 2014-06-16 |      556 |
| 2014-06-17 |      958 |
| 2014-06-18 |     2209 |
| 2014-06-19 |     1004 |
| 2014-06-20 |     1049 |
| 2014-06-21 |      566 |
| 2014-06-22 |      606 |
| 2014-06-23 |      767 |
| 2014-06-24 |      745 |
| 2014-06-25 |      503 |
| 2014-06-26 |      478 |
| 2014-06-27 |      406 |
| 2014-06-28 |      340 |
| 2014-06-29 |      328 |
| 2014-06-30 |      374 |
| 2014-07-01 |      441 |
| 2014-07-02 |      399 |
| 2014-07-03 |      391 |
| 2014-07-04 |      375 |
| 2014-07-05 |      388 |
| 2014-07-06 |      309 |
| 2014-07-07 |      406 |
| 2014-07-08 |      369 |
| 2014-07-09 |      401 |
| 2014-07-10 |      404 |
| 2014-07-11 |      391 |
| 2014-07-12 |      342 |
| 2014-07-13 |      329 |
| 2014-07-14 |      338 |
| 2014-07-15 |      400 |
| 2014-07-16 |      549 |
| 2014-07-17 |      479 |
| 2014-07-18 |      406 |
| 2014-07-19 |      331 |
| 2014-07-20 |      304 |
| 2014-07-21 |      380 |
| 2014-07-22 |      392 |
| 2014-07-23 |      385 |
| 2014-07-24 |      374 |
| 2014-07-25 |      371 |
| 2014-07-26 |      327 |
| 2014-07-27 |      315 |
| 2014-07-28 |      387 |
| 2014-07-29 |      332 |
| 2014-07-30 |      420 |
| 2014-07-31 |      461 |
| 2014-08-01 |      413 |
| 2014-08-02 |      369 |
| 2014-08-03 |      328 |
| 2014-08-04 |      342 |
| 2014-08-05 |      384 |
| 2014-08-06 |      329 |
| 2014-08-07 |      371 |
| 2014-08-08 |      323 |
| 2014-08-09 |      326 |
| 2014-08-10 |      302 |
| 2014-08-11 |      366 |
| 2014-08-12 |      366 |
| 2014-08-13 |      342 |
| 2014-08-14 |      358 |
| 2014-08-15 |      334 |
| 2014-08-16 |      284 |
| 2014-08-17 |      286 |
| 2014-08-18 |      371 |
| 2014-08-19 |      332 |
| 2014-08-20 |      349 |
| 2014-08-21 |      328 |
| 2014-08-22 |      288 |
| 2014-08-23 |      341 |
| 2014-08-24 |      294 |
| 2014-08-25 |      430 |
| 2014-08-26 |      374 |
| 2014-08-27 |      330 |
| 2014-08-28 |      361 |
| 2014-08-29 |      329 |
| 2014-08-30 |      291 |
| 2014-08-31 |      303 |
| 2014-09-01 |      350 |
| 2014-09-02 |      471 |
| 2014-09-03 |      399 |
| 2014-09-04 |      404 |
| 2014-09-05 |      390 |
| 2014-09-06 |      378 |
| 2014-09-07 |      342 |
| 2014-09-08 |      315 |
| 2014-09-09 |      363 |
| 2014-09-10 |      641 |
| 2014-09-11 |      645 |
| 2014-09-12 |      555 |
| 2014-09-13 |      625 |
| 2014-09-14 |      522 |
| 2014-09-15 |      554 |
| 2014-09-16 |      739 |
| 2014-09-17 |      734 |
| 2014-09-18 |      746 |
| 2014-09-19 |      675 |
| 2014-09-20 |      653 |
| 2014-09-21 |      578 |
| 2014-09-22 |      616 |
| 2014-09-23 |      632 |
| 2014-09-24 |      610 |
| 2014-09-25 |      675 |
| 2014-09-26 |      587 |
| 2014-09-27 |      498 |
| 2014-09-28 |      500 |
| 2014-09-29 |      481 |
| 2014-09-30 |      427 |
| 2014-10-01 |      560 |
| 2014-10-02 |      393 |
| 2014-10-03 |      335 |
| 2014-10-04 |      329 |
| 2014-10-05 |      267 |
| 2014-10-06 |      284 |
| 2014-10-07 |      312 |
| 2014-10-08 |      329 |
| 2014-10-09 |      325 |
| 2014-10-10 |      362 |
| 2014-10-11 |      406 |
| 2014-10-12 |      358 |
| 2014-10-13 |      486 |
| 2014-10-14 |      625 |
| 2014-10-15 |      550 |
| 2014-10-16 |      431 |
| 2014-10-17 |      832 |
| 2014-10-18 |      625 |
| 2014-10-19 |      513 |
| 2014-10-20 |      575 |
| 2014-10-21 |      602 |
| 2014-10-22 |      559 |
| 2014-10-23 |      654 |
| 2014-10-24 |      590 |
| 2014-10-25 |      482 |
| 2014-10-26 |      423 |
| 2014-10-27 |      447 |
| 2014-10-28 |      416 |
| 2014-10-29 |      386 |
| 2014-10-30 |      479 |
| 2014-10-31 |      449 |
| 2014-11-01 |      566 |
| 2014-11-02 |      453 |
| 2014-11-03 |      433 |
| 2014-11-04 |      474 |
| 2014-11-05 |      492 |
| 2014-11-06 |      527 |
| 2014-11-07 |      574 |
| 2014-11-08 |      524 |
| 2014-11-09 |      442 |
| 2014-11-10 |      776 |
| 2014-11-11 |     3310 |
| 2014-11-12 |      747 |
| 2014-11-13 |      473 |
| 2014-11-14 |      506 |
| 2014-11-15 |      453 |
| 2014-11-16 |      478 |
| 2014-11-17 |      469 |
| 2014-11-18 |      482 |
| 2014-11-19 |      419 |
| 2014-11-20 |      360 |
| 2014-11-21 |      332 |
| 2014-11-22 |      283 |
| 2014-11-23 |      269 |
| 2014-11-24 |      349 |
| 2014-11-25 |      270 |
| 2014-11-26 |      157 |
| 2014-11-27 |       16 |
| 2015-10-14 |        1 |
| 2171-09-13 |        1 |
+------------+----------+
459 rows in set (0.15 sec)

mysql> SELECT COLOR, COUNT(*) FROM jd_comment GROUP BY COLOR;
+--------------+----------+
| COLOR        | COUNT(*) |
+--------------+----------+
|              |       10 |
| 2013-09-20   |        1 |
| 2013-09-21   |        4 |
| 2013-09-22   |        1 |
| 2013-09-26   |        3 |
| 2013-09-27   |        4 |
| 2013-10-05   |        1 |
| 2013-10-07   |        1 |
| 2013-10-17   |        1 |
| 2013-10-18   |        1 |
| 2013-10-21   |        1 |
| 2013-10-26   |        3 |
| 2013-10-27   |        2 |
| 2013-10-28   |        1 |
| 2013-10-29   |        1 |
| 2013-11-04   |        2 |
| 2013-11-05   |        1 |
| 2013-11-07   |        1 |
| 2013-11-08   |        1 |
| 2013-11-11   |        1 |
| 2013-12-09   |        1 |
| 2013-12-13   |        1 |
| 2013-12-17   |        1 |
| 2014-01-02   |        2 |
| 2014-01-03   |        1 |
| 2014-01-06   |        1 |
| 2014-01-07   |        1 |
| 2014-01-10   |        2 |
| 2014-01-12   |        2 |
| 2014-01-13   |        4 |
| 2014-01-14   |        4 |
| 2014-01-15   |        3 |
| 2014-01-16   |        4 |
| 2014-01-17   |        3 |
| 2014-01-18   |        2 |
| 2014-01-20   |        5 |
| 2014-01-21   |        5 |
| 2014-01-22   |        7 |
| 2014-01-23   |       14 |
| 2014-01-24   |       14 |
| 2014-01-25   |       13 |
| 2014-01-26   |       16 |
| 2014-02-02   |        2 |
| 2014-02-03   |        1 |
| 2014-02-07   |        1 |
| 2014-02-09   |        1 |
| 2014-02-10   |        3 |
| 2014-02-11   |        2 |
| 2014-05-19   |        1 |
| 2014-05-20   |        2 |
| 2014-05-22   |        2 |
| 2014-05-24   |        1 |
| 2014-05-25   |        1 |
| 2014-05-26   |        1 |
| 2014-05-28   |        2 |
| 2014-05-30   |        1 |
| 2014-05-31   |        4 |
| 2014-06-01   |        1 |
| 2014-06-02   |        3 |
| 2014-06-03   |        3 |
| 2014-06-04   |        2 |
| 2014-06-05   |        4 |
| 2014-06-08   |        1 |
| 2014-06-09   |        6 |
| 2014-06-10   |        3 |
| 2014-06-11   |        3 |
| 2014-06-12   |        1 |
| 2014-06-13   |        2 |
| 2014-06-14   |        1 |
| 2014-06-15   |        1 |
| 2014-06-16   |        3 |
| 2014-06-17   |        3 |
| 2014-06-18   |        7 |
| 2014-06-19   |        5 |
| 2014-06-20   |        1 |
| 2014-06-21   |        1 |
| 2014-06-22   |        2 |
| 2014-06-23   |        3 |
| 2014-06-24   |        2 |
| 2014-06-25   |        2 |
| 2014-06-26   |        3 |
| 2014-06-27   |        1 |
| 2014-06-28   |        1 |
| 2014-06-29   |        2 |
| 2014-07-02   |        3 |
| 2014-07-03   |        4 |
| 2014-07-04   |        1 |
| 2014-07-05   |        3 |
| 2014-07-06   |        1 |
| 2014-07-07   |        2 |
| 2014-07-08   |        3 |
| 2014-07-09   |        1 |
| 2014-07-10   |        1 |
| 2014-07-11   |        1 |
| 2014-07-12   |        2 |
| 2014-07-13   |        2 |
| 2014-07-14   |        3 |
| 2014-07-15   |        4 |
| 2014-07-16   |        1 |
| 2014-07-17   |        4 |
| 2014-07-18   |        3 |
| 2014-07-19   |        3 |
| 2014-07-21   |        3 |
| 2014-07-22   |        2 |
| 2014-07-23   |        2 |
| 2014-07-24   |        2 |
| 2014-07-25   |        3 |
| 2014-07-27   |        2 |
| 2014-07-28   |        3 |
| 2014-07-30   |        3 |
| 2014-07-31   |        3 |
| 2014-08-01   |        1 |
| 2014-08-02   |        1 |
| 2014-08-04   |        2 |
| 2014-08-05   |        3 |
| 2014-08-07   |        3 |
| 2014-08-08   |        2 |
| 2014-08-09   |        1 |
| 2014-08-11   |        5 |
| 2014-08-12   |        2 |
| 2014-08-13   |        5 |
| 2014-08-14   |        3 |
| 2014-08-15   |        2 |
| 2014-08-16   |        2 |
| 2014-08-17   |        1 |
| 2014-08-18   |        4 |
| 2014-08-19   |        4 |
| 2014-08-20   |        4 |
| 2014-08-21   |        4 |
| 2014-08-22   |        2 |
| 2014-08-23   |        2 |
| 2014-08-24   |        2 |
| 2014-08-25   |        2 |
| 2014-08-26   |        1 |
| 2014-08-28   |        1 |
| 2014-08-29   |        4 |
| 2014-08-30   |        3 |
| 2014-08-31   |        1 |
| 2014-09-01   |        1 |
| 2014-09-02   |        2 |
| 2014-09-03   |        2 |
| 2014-09-04   |        5 |
| 2014-09-05   |        6 |
| 2014-09-06   |        5 |
| 2014-09-07   |        6 |
| 2014-09-08   |        4 |
| 2014-09-09   |        2 |
| 2014-09-10   |        7 |
| 2014-09-11   |        5 |
| 2014-09-12   |        4 |
| 2014-09-13   |        9 |
| 2014-09-14   |        3 |
| 2014-09-15   |        5 |
| 2014-09-16   |       11 |
| 2014-09-17   |       11 |
| 2014-09-18   |        3 |
| 2014-09-19   |       13 |
| 2014-09-20   |        7 |
| 2014-09-21   |        8 |
| 2014-09-22   |        8 |
| 2014-09-23   |        8 |
| 2014-09-24   |        8 |
| 2014-09-25   |       12 |
| 2014-09-26   |       10 |
| 2014-09-27   |        8 |
| 2014-09-28   |        5 |
| 2014-09-29   |        9 |
| 2014-09-30   |        6 |
| 2014-10-01   |        7 |
| 2014-10-02   |        8 |
| 2014-10-03   |        3 |
| 2014-10-04   |        3 |
| 2014-10-05   |        2 |
| 2014-10-06   |        4 |
| 2014-10-07   |        1 |
| 2014-10-08   |        7 |
| 2014-10-09   |        8 |
| 2014-10-10   |        6 |
| 2014-10-11   |        3 |
| 2014-10-12   |        7 |
| 2014-10-13   |        9 |
| 2014-10-14   |       15 |
| 2014-10-15   |       25 |
| 2014-10-16   |       17 |
| 2014-10-17   |       16 |
| 2014-10-18   |       16 |
| 2014-10-19   |       18 |
| 2014-10-20   |       24 |
| 2014-10-21   |       23 |
| 2014-10-22   |       20 |
| 2014-10-23   |       24 |
| 2014-10-24   |       21 |
| 2014-10-25   |       28 |
| 2014-10-26   |       24 |
| 2014-10-27   |       30 |
| 2014-10-28   |       25 |
| 2014-10-29   |       28 |
| 2014-10-30   |       30 |
| 2014-10-31   |       55 |
| 2014-11-01   |       67 |
| 2014-11-02   |       53 |
| 2014-11-03   |       59 |
| 2014-11-04   |       61 |
| 2014-11-05   |       60 |
| 2014-11-06   |       69 |
| 2014-11-07   |       80 |
| 2014-11-08   |       78 |
| 2014-11-09   |       65 |
| 2014-11-10   |      146 |
| 2014-11-11   |      544 |
| 2014-11-12   |      185 |
| 2014-11-13   |       91 |
| 2014-11-14   |      104 |
| 2014-11-15   |      102 |
| 2014-11-16   |       98 |
| 2014-11-17   |      106 |
| 2014-11-18   |       84 |
| 2014-11-19   |       77 |
| 2014-11-20   |       78 |
| 2014-11-21   |       78 |
| 2014-11-22   |       65 |
| 2014-11-23   |       49 |
| 2014-11-24   |       54 |
| 2014-11-25   |       34 |
| 2014-11-26   |       29 |
| 2014-11-27   |        3 |
| 深空灰       |    14136 |
| 深空灰色     |      475 |
| 灰           |       34 |
| 白           |    18094 |
| 白色         |     5784 |
| 粉           |     1690 |
| 粉色         |       37 |
| 蓝           |     2991 |
| 蓝色         |       90 |
| 金           |    55189 |
| 金色         |     2972 |
| 银           |    24965 |
| 银色         |     2210 |
| 黄           |      215 |
| 黄色         |       69 |
| 黑           |     7892 |
| 黑色         |     1113 |
+--------------+----------+
243 rows in set (0.18 sec)

mysql> UPDATE jd_comment SET COLOR = '' WHERE COLOR REGEXP '^[0-9]+\\-[0-9]+\\-[0-9]+';
Query OK, 3580 rows affected (0.25 sec)
Rows matched: 3580  Changed: 3580  Warnings: 0

mysql> SELECT VIP, COUNT(*) FROM jd_comment GROUP BY VIP;
+--------------+----------+
| VIP          | COUNT(*) |
+--------------+----------+
|              |    11377 |
| 企业会员     |     1633 |
| 注册会员     |       11 |
| 金牌会员     |    47791 |
| 钻石会员     |    38544 |
| 铜牌会员     |      931 |
| 银牌会员     |    41259 |
+--------------+----------+
7 rows in set (0.25 sec)

mysql> SELECT USER_FROM, COUNT(*) FROM jd_comment GROUP BY USER_FROM;
+-----------+----------+
| USER_FROM | COUNT(*) |
+-----------+----------+
|           |    26621 |
| 上海      |    10723 |
| 云南      |      687 |
| 内蒙古    |      568 |
| 北京      |    26824 |
| 台湾      |        4 |
| 吉林      |      827 |
| 四川      |     8067 |
| 天津      |     2699 |
| 宁夏      |      159 |
| 安徽      |     2388 |
| 山东      |     3676 |
| 山西      |      985 |
| 广东      |    15191 |
| 广西      |      981 |
| 新疆      |      404 |
| 江苏      |     9598 |
| 江西      |     1207 |
| 河北      |     3073 |
| 河南      |     2655 |
| 浙江      |     5012 |
| 海南      |      356 |
| 湖北      |     4324 |
| 湖南      |     1872 |
| 澳门      |        1 |
| 甘肃      |      657 |
| 福建      |     2702 |
| 西藏      |      118 |
| 贵州      |      821 |
| 辽宁      |     2377 |
| 重庆      |     1907 |
| 钓鱼岛    |       35 |
| 陕西      |     2780 |
| 青海      |      166 |
| 香港      |       32 |
| 黑龙江    |     1049 |
+-----------+----------+
36 rows in set (0.19 sec)



